{"batch_id":"corpus-expansion-001-softgym","candidates":[{"action_class":"aicor:Pouring","candidate_id":"cand-1","components":[{"component_id":"s1","component_kind":"strategy","description":"A reported pouring control strategy in which the held cup is manipulated via x and y displacement together with rotation.","grounding_note":"The source supports a task control interface/action space description, but the offered class paf:PouringStrategy carries additional restrictions not established by the passage.","grounding_status":"needs_mapping"}],"derivation_mode":"source_paraphrase","epistemic_status":"proposed_strategy","evidence_status":"source_anchored","frame_class":"paf:PouringKnowledgeFrame","knowledge_kind":"strategy_description","modality":"conditional","perspectives":["procedural"],"source_support":[{"document_id":"lin-etal-softgym-arxiv-2011.07215v2","exact_quote":"PourWater Pour a cup of water into a target cup. The agent directly controls the position and rotation\nof the cup at hand. Specifically, the action space of the agent is a vector a = (dx , dy , dθ ), representing\nthe displacement of the cup in the x, y dimension and its rotation around its geometric center. The\nreward is the fraction of water that is successfully poured into the target cup.\n","passage_id":"pourwater-task","support_role":"asserts_claim"}],"statement":"In the reported PourWater task formulation, pouring is carried out by directly controlling the held cup's position and rotation through x/y displacement and rotation updates."},{"action_class":"aicor:Pouring","candidate_id":"cand-2","components":[{"component_id":"o1","component_kind":"observation_pattern","description":"An observation pattern that measures the fraction of water successfully poured into the target cup.","grounding_status":"grounded","ontology_class":"makf:ObservationPattern"}],"derivation_mode":"source_paraphrase","epistemic_status":"proposed_strategy","evidence_status":"source_anchored","frame_class":"paf:PouringKnowledgeFrame","knowledge_kind":"observation_expectation","modality":"conditional","perspectives":["observational"],"source_support":[{"document_id":"lin-etal-softgym-arxiv-2011.07215v2","exact_quote":"reward is the fraction of water that is successfully poured into the target cup.","passage_id":"pourwater-task","support_role":"asserts_claim"}],"statement":"For the reported PourWater task, the success measure is the fraction of water successfully poured into the target cup."},{"action_class":"aicor:Pouring","candidate_id":"cand-3","components":[{"component_id":"c1","component_kind":"applicability_condition","description":"A task setup condition with both controlled and target cups modeled as cuboids without the top face, while cup height, length, width, distance between cups, and controlled-cup water volume are varied.","grounding_status":"grounded","ontology_class":"makf:ApplicabilityCondition"}],"derivation_mode":"source_paraphrase","epistemic_status":"proposed_strategy","evidence_status":"source_anchored","frame_class":"paf:PouringKnowledgeFrame","knowledge_kind":"observation_expectation","modality":"conditional","perspectives":["applicability"],"reviewer_note":"The source passage describes task/setup conditions rather than a strategy; this candidate is limited to applicability-relevant setup content using a broad offered condition class.","source_support":[{"document_id":"lin-etal-softgym-arxiv-2011.07215v2","exact_quote":"PourWater, PourWaterAmount: For this task, both the controlled cup and the target cup are\nmodeled as cuboids without the top face. We vary the height, length, and width of both cups, the\ndistance between the controlled cup and the target cup, as well as the volume of water in the controlled\ncup. ","passage_id":"pouring-variations","support_role":"asserts_claim"}],"statement":"In the reported PourWater and PourWaterAmount task setup, relevant task conditions include open-top cuboid controlled and target cups, with variation in cup dimensions, inter-cup distance, and the volume of water in the controlled cup."}],"documents":[{"document_id":"lin-etal-softgym-arxiv-2011.07215v2","passages":[{"locator":"arXiv 2011.07215v2, Section 4, Tasks, PDF pages 4-4","passage_id":"pourwater-task","text":"PourWater Pour a cup of water into a target cup. The agent directly controls the position and rotation\nof the cup at hand. Specifically, the action space of the agent is a vector a = (dx , dy , dθ ), representing\nthe displacement of the cup in the x, y dimension and its rotation around its geometric center. The\nreward is the fraction of water that is successfully poured into the target cup.\n"},{"locator":"arXiv 2011.07215v2, Section 3, fluid model, PDF pages 3-3","passage_id":"fluid-model","text":"Fluids can naturally be modeled in a particle system, as detailed in [42]; specifically, a constant\ndensity constraint is applied to each particle to enforce the incompressibility of the fluid. For each\nparticle, the constant density constraint is based on the position of that particle, as well as the positions\nof its neighboring particles.\n"},{"locator":"arXiv 2011.07215v2, Appendix, task variations, PDF pages 14-14","passage_id":"pouring-variations","text":"PourWater, PourWaterAmount: For this task, both the controlled cup and the target cup are\nmodeled as cuboids without the top face. We vary the height, length, and width of both cups, the\ndistance between the controlled cup and the target cup, as well as the volume of water in the controlled\ncup. "}],"synthetic_demo":false,"title":"SoftGym: Benchmarking Deep Reinforcement Learning for Deformable Object Manipulation","uri":"https://arxiv.org/abs/2011.07215v2"}],"extraction_run":{"engine":"openai","model_name":"gpt-5.4-2026-03-05","prompt_version":"makf-e2.2-v3","recorded_at":"2026-10-24T18:15:32.721779+00:00"},"profile_id":"pouring-v0.1"}
